[
  {
    "mob": ["minecraft:zombie"],
    "persecond": 60,
    "attempts": 20,
    "amount": {
      "minimum": 4,
      "maximum": 4
    },
    "conditions": {
      "dimension": "minecraft:overworld",
      "inwater": false,
      "mindist": 16,
      "maxdist": 96,
      "maxlocal": 24
    }
  }
]
